{
  "artifacts": [
    {
      "description": "Human-readable regional fixture values",
      "id": "rms_ap-csv",
      "resource": {
        "bytes": 45,
        "codec": {
          "decoded_bytes": 45,
          "name": "none"
        },
        "media_type": "text/csv",
        "path": "rms_ap.csv",
        "sha256": "90e8b0c0352b35464b647cefda16a8bd7a7154a10fed5256edee577c6e6eff65"
      },
      "role": "current-feature"
    }
  ],
  "description": "Synthetic feature exercising regional values, descriptive statistics, histogram, volume chunks and download metadata.",
  "display": {
    "regional": {
      "colormap": "viridis",
      "distribution_domains": [
        {
          "kind": "full"
        },
        {
          "bounds": [
            0.0,
            3.0
          ],
          "kind": "focused"
        }
      ],
      "diverging_center": 0.0,
      "preferred_distribution_domain": "focused",
      "preferred_scale": "symlog",
      "range": [
        -0.5,
        3.5
      ],
      "scales": [
        {
          "kind": "linear"
        },
        {
          "kind": "symlog",
          "linear_threshold": 0.5
        }
      ]
    },
    "volume": {
      "colormap": "magma",
      "distribution_domains": [
        {
          "kind": "full"
        },
        {
          "bounds": [
            1.0,
            18.0
          ],
          "kind": "focused"
        }
      ],
      "preferred_distribution_domain": "full",
      "preferred_scale": "log",
      "range": [
        0.1,
        19.1
      ],
      "scales": [
        {
          "kind": "linear"
        },
        {
          "kind": "log"
        },
        {
          "kind": "symlog",
          "linear_threshold": 1.0
        }
      ]
    }
  },
  "id": "rms_ap",
  "label": "AP RMS (golden fixture)",
  "representations": {
    "regional": {
      "format": "ephys-atlas-regional-v1",
      "parcellations": [
        {
          "parcellation_id": "allen",
          "statistics": {
            "format": "ephys-atlas-regional-statistics-v1",
            "resource": {
              "bytes": 6592,
              "codec": {
                "decoded_bytes": 6592,
                "name": "none"
              },
              "media_type": "application/json",
              "path": "allen.statistics.json",
              "sha256": "281f9bfd8f7d149aae4c27b261b7d77d29e85241866b9a30d8d3aa16340dcd10"
            }
          },
          "summary": "mean",
          "values": {
            "dtype": "float32",
            "endianness": "little",
            "format": "raw-binary-array-v1",
            "order": "C",
            "resource": {
              "bytes": 16,
              "codec": {
                "decoded_bytes": 16,
                "name": "none"
              },
              "media_type": "application/octet-stream",
              "path": "allen.values.f32",
              "sha256": "a1af495da02f97f69cf092d25ec0a424a1d70932e21755134ab5bcd869ff860d"
            },
            "shape": [
              4
            ]
          }
        }
      ]
    },
    "volume": {
      "array": {
        "dtype": "float32",
        "endianness": "little",
        "order": "C"
      },
      "encoding": {
        "layout": "chunks3d",
        "resource_index": {
          "format": "ephys-atlas-volume-resource-index-v1",
          "resource": {
            "bytes": 5369,
            "codec": {
              "decoded_bytes": 5369,
              "name": "none"
            },
            "media_type": "application/json",
            "path": "volume/resource-index.json",
            "sha256": "927b37693f522ad582889433c61f678e54bed318db7afc2601641d03ce2f5c1a"
          }
        }
      },
      "format": "ephys-atlas-volume-v1",
      "grid": {
        "grid_id": "golden-grid-25um",
        "index_convention": "integer-centers-half-integer-edges",
        "index_to_world_um": [
          0,
          25.0,
          0,
          0,
          25.0,
          0,
          0,
          0,
          0,
          0,
          25.0,
          0,
          0,
          0,
          0,
          1
        ],
        "reference_space_id": "allen-ccf-2017",
        "shape": [
          8,
          6,
          4
        ],
        "voxel_edge_extent_um": [
          -12.5,
          137.5,
          -12.5,
          187.5,
          -12.5,
          87.5
        ],
        "world_axes": [
          "ml",
          "ap",
          "dv"
        ],
        "world_to_index": [
          0,
          0.04,
          0,
          0,
          0.04,
          0,
          0,
          0,
          0,
          0,
          0.04,
          0,
          0,
          0,
          0,
          1
        ]
      },
      "summary": {
        "format": "ephys-atlas-volume-summary-v1",
        "resource": {
          "bytes": 5121,
          "codec": {
            "decoded_bytes": 5121,
            "name": "none"
          },
          "media_type": "application/json",
          "path": "volume/summary.json",
          "sha256": "3abd2f7afb889c399c91eb74194b8908de59503fd198d280ad7972afc82dcb9e"
        }
      },
      "validity": {
        "classification_order": [
          "outside",
          "missing",
          "valid"
        ],
        "kind": "sentinel",
        "missing_values": "nonfinite",
        "outside_value": -9999
      }
    }
  },
  "schema_version": "1.0",
  "unit": "dB rel. V",
  "value_semantics": {
    "missing_values": "non-finite observations are excluded from summaries and histograms",
    "qc_filter": "none; synthetic fixture",
    "quantity": "synthetic AP RMS-like scalar",
    "source_column": "rms_ap",
    "source_population": "synthetic fixture observations",
    "transform": "identity; fixture values are already display values"
  }
}
